{"eventId":"audit_event_dev_run_persist_001_0001","schemaVersion":"1.0.0","runRef":"dev_run_persist_001","sequence":1,"previousEventHash":"0000000000000000000000000000000000000000000000000000000000000000","eventType":"run_created","payloadHash":"aaaaaaaaaaaaaaaaaaaaaaaaaaaaaaaaaaaaaaaaaaaaaaaaaaaaaaaaaaaaaaaa","createdAt":"2026-07-10T00:00:00.000Z","eventHash":"bbbbbbbbbbbbbbbbbbbbbbbbbbbbbbbbbbbbbbbbbbbbbbbbbbbbbbbbbbbbbbbb"}
